brand_name,product_name,price_usd,product_description,ingredients,review_count,country
numbuzin,No.5 Vitamin Concentrated Serum,20.8,"Revitalize dull skin with this serum packed with antioxidant-rich vitamins to help restore skin’s natural glow. Additional brightening agents including glutathione, niacinamide and alpha-arbutin offer a major radiance boost. Plant extracts from sugarcane, turmeric root and mushroom minimize irritation.","['vaccinium vitis-idaea fruit extract', ' butylene glycol', ' niacinamide', ' panthenol', ' tranexamic acid', 'water', ' 1', '2-hexanediol', ' neopentyl glycol dicaprate', ' caprylic/capric triglyceride', ' sorbitol', ' bifida ferment lysate', ' chondrus crispus extract', ' butyrospermum parkii (shea) butter', ' saccharum officinarum (sugarcane) extract', 'alpha arbutin', ' sodium hyaluronate', ' melia azadirachta flower extract', ' ocimum sanctum leaf extract', ' melia azadirachta leaf extract', ' curcuma longa (turmericjroot extract', ' corallina officinalis extract', ' tremella fuciformis (mushroom) extract', ' pentylene glycol', ' glycerin', ' 3-0-ethyl ascorbic acid', ' bisabolol', ' tromethamine', ' ethylhexylglycerin', ' adenosine', ' hydrogenated lecithin', ' allantoin', ' glutathione', ' ceramide np', ' beta-glucan', ' dipotassium glycyrrhizate', ' tocopherol', ' ascorbic acid', ' ascorbyl glucoside', ' tocopheryl acetate', ' hydroxypropyl cyclodextrin', ' ubiquinone', ' thioctic acid', ' potassium hydroxide', ' behenyl alcohol', ' carbomer', ' xanthan gum', ' disodium edta']",2918.0,South Korea
haruharu wonder,Black Rice Hyaluronic Toner Fragrance Free,12.6,"This version of haruharu wonder’s bestselling Black Rice Hyaluronic Toner is free of alcohol and fragrances. It’s formulated with 95% naturally derived ingredients, including 2,000ppm of Korean black rice extract, plus hyaluronic acid and beta-glucan to provide intense hydration while promoting skin cell regeneration. Toner is made to leave you with a plumped-up finish.","['water', ' betaine', ' glycerin', ' propanediol', ' scutellaria baicalensis root extract', ' oryza sativa (rice) extract(2', '000ppm)', ' phyllostachys pubescens shoot bark extract(2', '000ppm)', ' xanthan gum', ' cellulose gum', ' 1', '2-hexanediol', ' butylene glycol', ' pulsatilla koreana extract', ' zanthoxylum piperitum fruit extract', ' usnea barbata (lichen) extract', ' aspergillus ferment', ' sodium gluconate', ' hyaluronic acid(600ppm)', ' beta-glucan', ' tamarindus indica seed gum', ' panax ginseng root extract', ' glucose', ' cyclodextrin']",4838.0,South Korea
AXIS - Y,Vegan Collagen Eye Serum,17.0,Revive tired-looking eyes with AXIS - Y’s Vegan Collagen Serum. Its signature 6+1+1 formula includes six hydrating and brightening plant-derived ingredients (including jojoba seed oil and green apple extract). Serum is also packed with vegan collagen to target wrinkles and 5-Peptide Complex to enhance skin firmness. It comes in a rollerball dispenser for convenient application.,"['water', ' methylpropanediol', ' glycerin', ' 1', '2-hexanediol', ' niacinamide', ' butylene glycol', ' hydroxyethyl acrylate/sodium acryloyldimethyl taurate copolymer', ' c13-14 alkane', ' sodium acrylic acid/ma copolymer', ' c15-23 alkane', ' ethylhexylglycerin', ' collagen', ' adenosine', ' decyl glucoside', ' prunus mume fruit extract', ' limnanthes alba (meadowfoam) seed oil', ' pyrus malus (apple) fruit extract', ' carica papaya (papaya) fruit extract', ' vitis vinifera (grape) fruit extract', ' leuconostoc/radish root ferment filtrate', ' hydrogenated lecithin', ' helianthus annuus (sunflower) seed oil', ' simmondsia chinensis (jojoba) seed oil', ' ulmus davidiana root extract', ' amaranthus caudatus seed extract', ' ficus carica (fig) fruit extract', ' caprylyl glycol', ' centella asiatica extract', ' polyglyceryl-10 stearate', ' ceramide np', ' sodium hyaluronate', ' tocopherol', ' tripeptide-1', ' palmitoyl pentapeptide-4', ' hydrolyzed hyaluronic acid', ' hexapeptide-9', ' copper tripeptide-1', ' acetyl hexapeptide-8', ' sodium acetylated hyaluronate']",1011.0,South Korea
SKIN 1004,Madagascar Centella Poremizing Light Gel Cream,13.0,"Enriched with Himalayan pink salt, this refreshing gel cream helps remove dead skin cells and excess sebum to unclog pores for clear and refined skin. Additional ingredients of adenosine and aloe vera leaf extract improve skin elasticity, while niacinamide in the mix offers brightening benefits.","['centella asiatica extract(5096%)', 'water', ' propanediol', 'aloe barbadensis leaf juice', ' 1', '2-hexanediol', 'niacinamide', ' glycerin', ' xylitol', ' butylene glycol', ' cabomer', ' tromethamine', ' sodium polyacryloyldimethyl taurate', ' biosaccharide gum-1', ' betaine', ' pvp', ' sedum sarmentosum extract', ' hydrogenated polydecene', ' ethylhexylglycerin', ' adenosine', 'hydroxyethylcellulose', ' coccinia indica fruit extract', ' eclipta prostrata extract', ' hydrolyzed gardenia florida extract', ' hydrolyzed malt extract', ' disodium edta', ' hydrolyzed viola tricolor extract', ' melia azadirachta flower extract', ' ocimum sanctum leaf extract', ' melia azadirachta leaf extract', ' trideceth-10', 'water', ' panthenol', ' curcuma longa (turmeric) root extract', ' hyaluronic acid', ' hydrolyzed hyaluronic acid', ' sodium hyaluronate', ' xylitylglucoside', ' corallina officinalis extract', ' anhydroxylitoll', ' oenothera biennis (evening primrose) flower extract', ' pueraria lobata root extract', 'pinus palustris leaf extract', ' ulmus davidiana root extract', ' castanea crenata (chestnut) shell extract', 'water', ' lavandula angustifolia (lavender) flower extract', 'water', ' chenopodium quinoa seed extract', ' allatoin', ' kaolin', ' mineral salt']",1520.0,South Korea
Dr. Althea,Vitamin C Boosting Serum,21.51,"Perk up lackluster skin with this serum powered by Vita Boosting Complex to brighten skin and tackle hyperpigmentation. The vegan formula contains eight types of hyaluronic acid to keep hydration levels high, as well as allantoin and tocopherol to combat signs of aging.","['water', 'water', ' niacinamide', ' butylene glycol', ' 1', '2-hexanediol', ' dipropylene glycol', 'water', ' methyl gluceth-20', ' methylpropanediol', ' betaine', ' tranexamic acid', ' glycerin', ' pentylene glycol', ' propanediol', ' hydroxyethyl urea', ' laminaria japonica extract', ' eclipta prostrata leaf extract', ' ficus carica (fig) fruit extract', ' centella asiatica extract', ' hydrogenated lecithin', ' sodium hyaluronate', ' carbomer', ' 3-o-ethyl ascorbic acid', ' c12-14 pareth-12', ' ammonium acryloyldimethyltaurate/vp copolymer', ' xanthan gum', ' tromethamine', ' panthenol', ' ethylhexylglycerin', ' adenosine', ' disodium edta', ' fructooligosaccharides', ' beta-glucan', ' ascorbic acid', ' hydrolyzed hyaluronic acid', ' ceramide np', 'alpha arbutin', ' tocopherol', ' bifida ferment lysate', ' bisabolol', ' ubiquinone', ' hydroxydecyl ubiquinone', ' sodium acetylated hyaluronate']",409.0,South Korea
haruharu wonder,Black Rice Moisture Deep Cleansing Oil,17.5,"Simple but powerful, this cleansing oil is formulated with 95% naturally derived plant oils for thorough cleansing and long-lasting hydration. Formula includes skin care superstar Korean black rice bran oil, which comes at 100% concentration and is laden with minerals and proteins for extra skin-strengthening. For a refreshed and revitalizing finish, incorporate into morning and evening routines.","['oryza sativa (rice) bran oil', ' caprylic/capric triglyceride', ' helianthus annuus (sunflower) seed oil', ' olea europaea (olive) fruit oil', ' sorbeth-30 tetraoleate', ' simmondsia chinensis (jojoba) seed oil', ' macadamia integrifolia seed oil', ' tocopherol', ' ethylhexylglycerin']",1861.0,South Korea
Beauty of Joseon,Dynasty Cream,24.0,,"['water', 'water', ' glycerin', 'water', ' hydrogenated polydecene', ' 1', '2-hexanediol', ' niacinamide', ' squalane', ' butylene glycol', ' propanediol', ' dicaprylate/dicaprate', ' cetearyl olivate', ' sorbitan olivate', ' ammonium acryloyldimethyltaurate/vp copolymer', ' xanthan gum', ' acrylates/c10-30 alkyl acrylate crosspolymer', ' tromethamine', ' carthamus tinctorius (safflower) seed oil', ' hydrogenated coconut oil', ' glyceryl acrylate/acrylic acid copolymer', ' ethylhexylglycerin', ' adenosine', ' caprylic/capric triglyceride', ' disodium edta', ' hyaluronic acid', ' hydrolyzed hyaluronic acid', ' sodium hyaluronate', ' honey extract', ' ceramide np', ' hydrogenated lecithin', ' coptis japonica root extract', ' raphanus sativus (radish) seed extract', ' lycium chinense fruit extract', ' theobroma cacao (cocoa) seed extract', ' phellinus linteus extract', ' dextrin', ' scutellaria baicalensis root extract']",3949.0,South Korea
APLB,Glutathione Niacinamide Facial Cream,9.8,This moisturizing cream is formulated with glutathione and niacinamide to deliver antioxidant and brightening properties to skin. It’s added with centella asiatica and adenosine to soothe skin while providing anti-aging effects. Lightweight texture quickly absorbs into skin. Hypoallergenic formula is suitable for various skin types including sensitive skin.,"['water', ' centella asiatica extract (227%)', ' glycerin', ' cetyl ethylhexanoate', ' butylene glycol', ' polyglyceryl-3 methylglucose distearate', ' niacinamide (20', '000ppm)', ' stearic acid', ' sodium polyacryloyldimethyl taurate', ' silica', ' sodium hyaluronate', ' glyceryl stearate', ' beeswax', ' butyrospermum parkii (shea) butter', ' macadamia ternifolia seed oil', ' hydrogenated polydecene', ' betaine', ' glutathione (1', '000ppm)', ' trehalose', ' adenosine', ' citric acid', ' trideceth-10', ' disodium edta', ' sodium citrate', ' caprylic/capric triglyceride', ' hydrogenated lecithin', ' cholesterol', ' xanthan gum', ' nelumbo nucifera extract', ' artemisia annua extract', ' oryza sativa (rice) extract', ' saccharomyces ferment', ' solanum melongena (eggplant) fruit extract', ' melaleuca alternifolia (tea tree) leaf extract', ' hydrolyzed collagen', ' squalane', ' beta-glucan', ' dipropylene glycol', ' hippophae rhamnoides fruit extract', ' madecassic acid', ' asiaticoside', ' asiatic acid', ' propanediol', ' hydroxyacetophenone', ' 1', '2-hexanediol', ' ethylhexylglycerin', ' dipotassium glycyrrhizate']",1465.0,South Korea
SKIN 1004,Madagascar Centella Toning Toner,15.83,"A gentle PHA toner that soothes, exfoliates, hydrates and brightens in equal measure. It contains 84% centella asiatica extract, hyaluronic acid, betaine, alongside other brightening and anti-aging ingredients to produce a fresh, supple, wrinkle-free finish. To use, soak a proper amount in cotton pad and wipe onto cleansed face, patting gently for optimal absorption.","['centella asiatica extract (84%)', 'water', ' dipropylene glycol', ' 1', '2-hexandiol', ' niacinamide', ' glu/conoractone', ' thrometamine', ' carbomer', ' sodium citrate', ' adenosine', ' disodium edta', ' dipotacium glycide', ' betaine', ' hyaluronic acid', ' ethylhexyglycerin']",1494.0,South Korea
Beauty of Joseon,Ground Rice and Honey Glow Mask,14.4,"This all-in-one wash-off mask leaves skin plump, smooth and radiant. Packed with kaolin clay, the face mask has sebum-absorbing and pore-purifying powers. Enriched with rice hull powder and 5% honey, the formula exfoliates away dead skin cells while hydrating skin. Use after cleansing step in your skin care routine.","['water', ' kaolin', ' honey', ' glycerin', ' propanediol', ' dipropylene glycol', ' oryza sativa (rice) hull powder', ' isononyl isononanoate', ' 1', '2-hexanediol', ' cetyl alcohol', ' caprylic/capric triglyceride', ' polyglyceryl-3 methylglucose distearate', ' butylene glycol', ' glyceryl stearate', ' oryza sativa (rice) bran', ' bentonite', ' palmitic acid', ' stearic acid', ' hydroxyacetophenone', ' behenyl alcohol', ' cellulose', ' zea mays (corn) starch', ' ethylhexylglycerin', ' xanthan gum', ' potassium cetyl phosphate', ' oryza sativa (rice) lees extract', ' polyacrylate-13', ' hydrogenated polyisobutene', ' sodium phytate', ' polyglyceryl-10 laurate', ' ethylhexyl palmitate', ' sorbitan isostearate', ' oryza sativa (rice) extract', ' menthyl lactate', ' honey extract']",1227.0,South Korea
Dr.G,R.E.D Blemish Clear Soothing Cream 70ml,24.47,"This recovery cream comes in a quick-absorbing gel-like texture. Formulated with madecassoside and asiatic acid from centella, not only does it provide moisture to soothe sensitive skin, but also boasts complexion-brightening qualities.","['water', ' glycerin', ' butylene glycol', ' c13-16 isoparaffin', ' niacinamide', ' c12-14 isoparaffin', ' 1', '2-hexanediol', ' hydrogenated polydecene', ' pentylene glycol', ' vinyl dimethicone', ' caprylyl methicone', ' hydroxyethyl acrylate/sodium acryloyldimethyl taurate copolymer', ' panthenol', ' acrylates/c10-30 alkyl acrylate crosspolymer', ' dimethiconol', ' polymethylsilsesquioxane', ' tromethamine', ' dipotassium glycyrrhizate', ' glyceryl acrylate/acrylic acid copolymer', ' ethylhexylglycerin', ' xanthan gum', ' disodium edta', ' beta-glucan', ' centella asiatica (gotu kola) extract', ' madecassoside', ' pyrus malus (apple) fruit extract', ' epigallocatechin gallate', ' asiaticoside', ' asiatic acid', ' madecassic acid']",2775.0,South Korea
Mary&May,Tranexamic Acid + Glutathione Eye Cream Mini,3.0,"Enriched with 1,000ppm of tranexamic acid and glutathione, this eye cream brightens dark circles and revitalizes skin around the eyes. It also contains Vitamin C to stimulate collagen production and improve skin radiance. This version is mini-sized.","['water', ' ethylhexyl palmitate', ' glycereth-26', ' glycerin', ' cetearyl alcohol', ' niacinamide', ' hydrogenated poly(c6-14 olefin)', ' beeswax', ' caprylic/capric triglyceride', ' polyglyceryl-2 stearate', ' dipropylene glycol', ' isododecane', ' glyceryl stearate', ' hydroxyethyl acrylate/sodium acryloyldimethyl taurate copolymer', ' stearyl alcohol', ' glycol stearate se', ' sodium polyacrylate', ' hydroxyacetophenone', ' stearic acid', ' dimethiconol', ' dimethicone/vinyl dimethicone crosspolymer', ' hydrogenated polydecene', ' hydrogenated lecithin', ' tranexamic acid (1', '000ppm)', ' betaine', ' glutathione (1', '000ppm)', ' panthenol', 'fragrance', ' hippophae rhamnoides fruit oil', ' butylene glycol', ' adenosine', ' sorbitan isostearate', ' caprylyl glycol', ' trideceth-6', ' 1', '2-hexanediol', ' disodium edta', ' sodium hyaluronate', ' ascorbic acid']",2703.0,South Korea
Beauty of Joseon,Glow Replenishing Rice Milk,16.2,"This moisturizing toner infused with rice extract and rice-derived amino acids combats skin dryness for a plump and radiant finish. It’s formulated with a sebum-controlling powder that effectively absorbs excess oil and purifies pores. Comes in a light, refreshing formula that penetrates deeply into skin without leaving any greasy feeling. Suitable for all skin types including sensitive skin.","['water', ' methylpropanediol', ' propanediol', ' 1', '2-hexanediol', ' glycerin', ' glycereth-26', ' polymethyl methacrylate', ' panthenol', ' hydroxyethyl urea', ' aluminum chlorohydrate', ' butylene glycol', ' kaolin', ' sodium citrate', ' microcrystalline cellulose', ' oryza sativa (rice) extract', ' ethylhexylglycerin', ' dipotassium glycyrrhizate', ' citric acid', ' hydrogenated lecithin', ' coptis japonica root extract', ' ulmus davidiana root extract', ' amaranthus caudatus seed extract', ' ficus carica (fig) fruit extract', ' centella asiatica extract', ' dextrin', ' theobroma cacao (cocoa) seed extract', ' ceramide np', ' tocopherol', ' sodium hyaluronate', ' rice amino acids']",1451.0,South Korea
SKIN 1004,Madagascar Centella Probio-Cica Intensive Ampoule,12.0,"Nourishing ampoule contains a high concentration of fermented cica extract to deliver intense moisture to skin and strengthen the skin barrier. Panthenol, betaine and allantoin in the formula provide plumping touches for smooth and hydrated skin. Suitable for sensitive skin.","['centella asiatica extract', ' butylene glycol', ' glycerin', 'water', ' propanediol', ' caprylic/capric triglyceride', ' niacinamide', ' lactobacillus/centella asiatica extract ferment filtrate', ' 1', '2-hexanediol', ' dipropylene glycol', ' polyglyceryl-3 distearate', ' acrylates/c10-30 alkyl acrylate crosspolymer', ' c14-22 alcohols', ' arginine', ' hydrogenated lecithin', ' betaine', ' allantoin', ' panthenol', ' hydroxystearic acid', ' ethylhexylglycerin', ' hydroxyethy acrylate/sodium acryloyldimethyl taurate copolymer', ' glyceryl stearate citrate', ' sodium polyacrylate', ' adenosine', ' c12-20 alkyl glucoside', ' cetearyl alcohol', ' xanthan gum', ' macadamia ternifolia seed oil', ' sodium phytate', ' sodium hyaluronate', ' stearic acid', ' ceramide np', ' glyceryl acrylate/acrylic acid copolymer', ' sorbitan lsostearate', ' polyglycery-10 myristate', ' madecassic acid', ' asiaticoside', ' phytosphingosine', ' aslatic acid', ' sucrose distearate', ' polyglutamnic acid', ' glucose', ' lauric acid', ' phytosterols']",1208.0,South Korea
numbuzin,No.5 Vitamin-Niacinamide Concentrated Pad,20.8,"Restore luster in tired skin with these toner pads infused with potent brightening agents including niacinamide, glutathione and antioxidant-rich Vitamin C to even skin tone and fade dark spots. Panthenol and mushroom extract provide moisturizing and elasticity care. Additional ingredients like PHA and LHA exfoliate away dead skin cells.","['water', ' niacinamide (50', '000 ppm)', ' dipropylene glycol', ' glycerin', ' propanediol', ' butylene glycol', ' hydroxyethyl urea', ' diethoxy ethyl succinate', ' hydroxyacetophenone', ' caprylyl glycol', ' polyglyceryl-10 laurate', ' betaine', ' panthenol (7501 ppm)', ' ethylhexylglycerin', ' gluconolactone', ' sodium polyacrylate', ' ammonium acryloyldimethyltaurate/vp copolymer', ' sodium citrate', ' citric acid', ' maltodextrin', ' 1', '2 hexanediol', ' gardenia florida fruit extract', ' dipotassium glycyrrhizate', ' sodium hyaluronate', ' ascorbic acid', ' pantolactone', ' tocopherol', 'salicylic acid', ' tranexamic acid', ' tremella fuciformis (mushroom) extract', ' caprylic/capric triglyceride', ' ascorbyl glucoside', ' ubiquinone', ' hydrogenated lecithin', ' magnesium chloride', ' alcohol', ' glutathione (03 ppm)', ' polysorbate 80', ' calcium gluconate', ' pyridoxine hcl', ' bht', ' yeast extract', ' cyanocobalamin', ' disodium edta']",2338.0,South Korea
celimax,JIWOOGAE Heartleaf BHA Peeling Pad,15.75,"These textured pealing pads are formulated with BHA to slough away dead skin cells and reveal bright and smooth skin. Saturated with a potent blend of hyaluronic acid and houttuynia cordata extract, they soothe and hydrate skin. Swipe the embossed side on face to remove impurities and moisturize skin, and then swipe the gauze side on the T-zone to exfoliate away blackheads and dead skin cells.","['water', ' dipropylene glycol', ' glycerin', ' butylene glycol', ' 1', '2-hexanediol', ' houttuynia cordata extract', ' betaine', 'water', ' betaine salicylate', 'madecassoside', ' asiaticoside', ' madecassic acid', ' asiatic acid', ' polyglyceryl-10 laurate', ' arginine', ' polyglyceryl-10 myristate', ' melaleuca alternifolia (tea tree) leaf oil', ' disodium edta', ' sodium hyaluronate', ' ethylhexylglycerin', ' chlorphenesin', ' limonene']",1044.0,South Korea
Beauty of Joseon,Glow Deep Serum,15.3,"Restore a natural glow to tired-looking skin with this brightening serum containing 68.6% rice bran water to clarify skin and 2% arbutin to fade hyperpigmentation. Lightweight and quick-absorbent texture penetrates deep into skin to provide long-lasting skin brightening and hydrating effects. Formulated without mineral oils, essential oils, parabens, sulfates and PEG, this product is suitable for sensitive skin.","['water', 'water', ' glycerin', 'butylene glycol', ' 1', '2-hexanediol', ' dipropylene glycol', 'alpha arbutin', ' niacinamide', ' methyl gluceth-20', ' panthenol', ' polyglycerin-3', ' trehalose', ' glyceryl glucoside', ' hydrolyzed jojoba esters', ' hydroxyethyl acrylate/sodiumacryloyldimethyl taurate copolymer', ' ethylhexylglycerin', ' hydroxyethylcellulose', ' xanthan gum', ' acrylates/c10-30 alkyl acrylate crosspolymer', ' arginine', ' disodium edta', ' coptis japonica root extract', ' sorbitan isostearate', ' glucose', ' coix lacryma-jobi ma-yuen seed extract', 'soybean', ' hordeum distichon (barley) extract', ' oryza sativa (rice) extract', ' sesamum indicum (sesame) seed extract', ' triticum vulgare (wheat) seed extract', ' vigna radiata seed extract', ' zea mays (corn) kernel extract']",3796.0,South Korea
Beauty of Joseon,Centella Asiatica Calming Mask,2.25,"Calming and soothing, this sheet mask is infused with 15% cica extract as well as three types of hyaluronic acids to treat irritated and sensitive skin. Suitable for all skin types. Leave on for 15-20 mins on cleansed and toned skin, then remove and gently pat in any excess.","['water', ' centella asiatica extract', ' glycereth-26', ' butylene glycol', ' niacinamide', ' 1', '2-hexanediol', ' hydroxyacetophenone', ' arginine', ' acrylates/c10-30 alkyl acrylate crosspolymer', ' hydroxyethylcellulose', ' carrageenan', ' polyglyceryl-4 caprate', ' polyglyceryl-6 caprylate', ' adenosine', ' ethylhexylglycerin', ' disodium edta', ' helianthus annuus (sunflower) seed oil', ' panthenol', ' artemisia princeps leaf extract', ' lycium chinense fruit extract', ' propandiol', ' portulaca oleracea extract', ' panax ginseng root extract', ' camellia sinensis leaf extract', ' anthemis nobilis flower oil', ' sodium hyaluronate', ' hydrolyzed hyaluronic acid', ' hyaluronic acid']",1556.0,South Korea
SKIN 1004,Madagascar Centella Ampoule Kit,23.9,Pamper your skin with this Madagascar Centella Ampoule Kit containing four mini-sized ampoules targeting different skin concerns. The Centella Ampoule soothes and repairs damaged skin. The Tone Brightening Capsule Ampoule evens skin tone for a radiant finish. The Poremizing Fresh Ampoule minimizes enlarged pore. The Tea-Trica Relief Ampoule calms irritation and treats acne. Take a few drops of the ampoule and gently apply on face.,"['water', ' butylene glycol', ' niacinamide', ' glycerin', ' tranexamic acid', ' 1', '2-hexanediol', ' betaine', ' centella asiatica extract', ' zea mays (corn) starch', ' xanthan gum', ' microcrystalline cellulose', ' mannitol', ' panthenol', ' pentylene glycol', ' ethylhexylglycerin', ' hydroxyethylcellulose', ' madecassoside', ' acrylates/c10-30 alkyl acrylate crosspolymer', ' arginine', ' hydrogenated lecithin', ' xylitylglucoside', ' anhydroxylitol', ' xylitol', ' glucose', ' 3-o-ethyl ascorbic acid', ' lactobacillus ferment [poremizing fresh ampoule] centella asiatica (gotu kola) extract(5047%)', 'water', ' butylene glycol', ' propanediol', ' 1', '2-hexanediol', 'aloe barbadensis leaf juice', ' glycereth-26 hydroxyacetophenone', ' glycerin', ' carbomer', ' tromethamine', ' panthenol ', ' ethylhexylglycerin', ' disodium edta', ' dipotassium glycyrrhizate', ' ammonium polyacryloyldimethyl taurate', ' biosaccharide gum-1', ' hyaluronic acid', ' hydrolyzed hyaluronic acid', ' sodium hyaluronate', ' hydroxyethylcellulose', ' chamomilla recutita (matricaria) flower extract', ' mineral salt', ' tripeptide-3', ' acetyl hexapeptide-8', ' acetyl octapeptide-3', ' copper tripeptide-1', ' palmitoyl pentapeptide-4', ' palmitoyl tetrapeptide-7', ' palmitoyl tripeptide-1', ' tripeptide-1', ' tripeptide-2 [tea-trica relief ampoule] centella asiatica extract(55%)', 'water', 'water', ' pinus palustris leaf extract', ' glycerine', ' butylene glycol', ' methyl gluceth-20', ' dipropylene glycol', ' glycereth-26', ' 1', '2-hexanediol', 'water', ' hydroxyacetophenone', ' ammonium acryloyldimethyltaurate/vp copolymer', ' propanediol', ' polyglyceryl-10 laurate', ' ethylhexylglycerin', ' pentylene glycol', ' caprylyl glycol', ' disodium edta melaleuca alternifolia leaf oil (200ppm)', ' oenothera biennis (evening primrose) flower extract', ' pueraria lobata root extrac', ' ulmus davidiana root extract']",1287.0,South Korea
Anua,Rice Enzyme Brightening Cleansing Powder,13.69,"Purify pores, brighten skin and amp up hydration levels with this multi-purpose rice bran-infused cleansing powder. The formula contains ceramide to strengthen the skin barrier and papain to slough away dead skin cells and impurities. For optimal benefits, mix an appropriate amount with water and massage the mixture onto skin before rinsing off with water. Alternatively, use as a wash-off mask for an instant glow-up.","['zea mays (corn) starch\xa0', ' sodium cocoyl isethionate\xa0', ' sodium lauroyl glutamate\xa0', ' diglycerin', ' allantoin', ' maltodextrin', ' papain', ' kaolin (ci 77004)\xa0', ' zea mays (corn) starch', ' sodium cocoyl isethionate', ' sodium lauroyl glutamate', ' diglycerin', ' allantoin', ' maltodextrin', ' papain', ' sodium bicarbonate', ' citric acid', ' sodium polyacrylate', 'water', ' oryza sativa (rice) powder', ' oryza sativa (rice) lees extract\xa0', 'water', ' 1', '2-hexanediol', ' oryza sativa (rice) extract', 'water', ' butylene glycol', ' 1', '2-hexanediol\xa0', ' dipropylene glycol', ' oryza sativa (rice) extract', ' hydrolyzed rice protein', ' oryza sativa (rice) seed protein', ' ceramide np', ' ceramide np', ' ascorbic acid', 'alpha arbutin', ' protease', ' butylene glycol', ' 1', '2-hexanediol', ' caprylyl glycol\xa0', ' glucose', ' papain\xa0', ' glycerin', 'water', ' citric acid', ' tartaric acid', 'iron oxides']",447.0,South Korea
